{
  "schema_version": "1.0",
  "updated": "2026-10-27",
  "scoring": {
    "benefit_weights": {
      "developer_value": 0.25,
      "cu_reduction": 0.2,
      "enterprise_value": 0.25,
      "differentiation": 0.15,
      "strategic_alignment": 0.15
    },
    "cost_weights": {
      "complexity": 0.5,
      "risk": 0.5
    },
    "thresholds": {
      "P1": 2.6,
      "P2": 1.8
    }
  },
  "items": [
    {
      "id": "PB-001",
      "title": "Sign the app and engine",
      "category": "Security and Enterprise Readiness",
      "problem": "Unsigned binaries are blocked by Smart App Control and WDAC on many PCs, so the engine doesn't start.",
      "capability": "Azure Trusted Signing in the release workflow for the exe and engine binaries.",
      "evidence": [
        "ci.yml signs only when Trusted Signing secrets exist",
        "PR #28 blocked"
      ],
      "features": [
        "FEAT-SEC-01",
        "FEAT-SHL-09"
      ],
      "external_dependencies": [
        "Chris creates the Azure Trusted Signing account (D-C3)",
        "Overlaps HD-021 enforce signing (waits on Chris, D-C3) (Codebase audit and hardening backlog, PB-101)"
      ],
      "acceptance": [
        "Released exe and engine DLLs carry a valid signature",
        "A Smart App Control PC starts the engine"
      ],
      "scores": {
        "developer_value": 3,
        "cu_reduction": 1,
        "enterprise_value": 5,
        "differentiation": 1,
        "strategic_alignment": 5,
        "complexity": 2,
        "risk": 2
      },
      "mandatory": "blocker",
      "owner": "Enterprise readiness",
      "source_refs": [
        "FD-103",
        "FD-104"
      ],
      "effort": "S",
      "confidence": "High",
      "state": "Proposed",
      "prs": [
        28
      ],
      "mandatory_reason": "Without signing the app does not run on many managed PCs; the launch audience is about 5,000 people.",
      "computed": {
        "benefit": 3.1,
        "cost": 2.0,
        "score": 2.48,
        "priority": "P0"
      }
    },
    {
      "id": "PB-002",
      "title": "Tenant smoke test of ten core flows",
      "category": "Reliability, Testing, and Performance",
      "problem": "Almost every Fabric-facing feature has only been tested with Fabric faked; the live test harness has never run.",
      "capability": "A scripted ten-flow smoke test on the maintainer's non-production workspace, plus one live-test harness run, with results recorded in the inventory.",
      "evidence": [
        "livetest.py never run",
        "docs/README.md lists features tried on the maintainer's tenant"
      ],
      "features": [
        "FEAT-SHL-01",
        "FEAT-AUTH-01",
        "FEAT-AUTH-04",
        "FEAT-FAB-01",
        "FEAT-FAB-06",
        "FEAT-FAB-07",
        "FEAT-ONE-05",
        "FEAT-META-14",
        "FEAT-OPS-04",
        "FEAT-PRV-01"
      ],
      "external_dependencies": [
        "Chris runs it on his non-production workspace",
        "Overlaps HD-029 live harness run (Chris); HD-053 OneLake contract tests; HD-054 T-SQL harness and live job (Codebase audit and hardening backlog, PB-101)"
      ],
      "acceptance": [
        "Ten flows pass or have recorded defects",
        "The inventory's verification moves only for flows that passed",
        "No production workspace is touched"
      ],
      "scores": {
        "developer_value": 3,
        "cu_reduction": 2,
        "enterprise_value": 5,
        "differentiation": 2,
        "strategic_alignment": 5,
        "complexity": 2,
        "risk": 2
      },
      "mandatory": "blocker",
      "owner": "Master product (unassigned)",
      "source_refs": [
        "FD-101",
        "FD-140"
      ],
      "duplicates": [
        "Ten-flow smoke test (honest review, 2026-10-16)",
        "Running the FD-101 harness once (enterprise readiness)"
      ],
      "effort": "M",
      "confidence": "High",
      "state": "Proposed",
      "mandatory_reason": "Launch to about 5,000 people needs evidence the core flows work on a real tenant.",
      "package": "docs/product/pr-ready/PB-002.md",
      "computed": {
        "benefit": 3.45,
        "cost": 2.0,
        "score": 2.76,
        "priority": "P0"
      }
    },
    {
      "id": "PB-003",
      "title": "Prove OneLake leases and MERGE writes live",
      "category": "Reliability, Testing, and Performance",
      "problem": "Leases depend on OneLake honoring conditional requests, which has never been tried.",
      "capability": "The live test extended to leases, two writers and MERGE.",
      "evidence": [
        "leases.py",
        "livetest.py lacks lease and MERGE checks"
      ],
      "features": [
        "FEAT-ORC-03",
        "FEAT-ONE-05"
      ],
      "depends_on": [
        "PB-002"
      ],
      "acceptance": [
        "A second writer is refused while a lease is held on OneLake",
        "A MERGE write on OneLake passes the profile check"
      ],
      "scores": {
        "developer_value": 1,
        "cu_reduction": 1,
        "enterprise_value": 5,
        "differentiation": 2,
        "strategic_alignment": 4,
        "complexity": 2,
        "risk": 2
      },
      "mandatory": "required",
      "owner": "Enterprise readiness",
      "source_refs": [
        "FD-101"
      ],
      "effort": "S",
      "confidence": "Medium",
      "state": "Proposed",
      "mandatory_reason": "If OneLake ignores conditional requests, concurrent writers can overwrite data.",
      "external_dependencies": [
        "Overlaps HD-016 cross-process leases; HD-029 live harness run (Codebase audit and hardening backlog, PB-101)"
      ],
      "computed": {
        "benefit": 2.6,
        "cost": 2.0,
        "score": 2.08,
        "priority": "P1"
      }
    },
    {
      "id": "PB-005",
      "title": "Encrypt the token cache",
      "category": "Security and Enterprise Readiness",
      "problem": "The MSAL token cache is a plain file on Windows.",
      "capability": "DPAPI-protected cache through msal-extensions.",
      "evidence": [
        "auth.py writes a plain cache file",
        "PR #593 encrypts the cache with DPAPI (HD-013); merged and promoted to Stable 3633b4a"
      ],
      "features": [
        "FEAT-AUTH-03"
      ],
      "external_dependencies": [
        "Decision D-C2",
        "Overlaps HD-013 DPAPI token cache (waits on Chris, D-C2) (Codebase audit and hardening backlog, PB-101)"
      ],
      "acceptance": [
        "The cache is unreadable to another Windows user",
        "Scheduled runs and the app share it safely"
      ],
      "scores": {
        "developer_value": 1,
        "cu_reduction": 1,
        "enterprise_value": 5,
        "differentiation": 1,
        "strategic_alignment": 4,
        "complexity": 2,
        "risk": 2
      },
      "mandatory": "required",
      "owner": "Enterprise readiness",
      "source_refs": [
        "FD-131b"
      ],
      "effort": "S",
      "confidence": "High",
      "state": "In review",
      "mandatory_reason": "Refresh tokens on disk unencrypted are a security finding any enterprise review will raise.",
      "computed": {
        "benefit": 2.45,
        "cost": 2.0,
        "score": 1.96,
        "priority": "P1"
      },
      "prs": [
        593
      ]
    },
    {
      "id": "PB-006",
      "title": "Content Security Policy for the main window",
      "category": "Security and Enterprise Readiness",
      "problem": "The main webview runs with csp: null and the Tauri global, so escaping is the only defense against injected HTML.",
      "capability": "Move notebook HTML output to another origin, then set a CSP.",
      "evidence": [
        "tauri.conf.json csp: null, withGlobalTauri: true"
      ],
      "features": [
        "FEAT-SEC-02"
      ],
      "acceptance": [
        "A CSP is set and the UI test suite passes",
        "Notebook HTML output can't call Tauri commands"
      ],
      "scores": {
        "developer_value": 1,
        "cu_reduction": 1,
        "enterprise_value": 5,
        "differentiation": 1,
        "strategic_alignment": 4,
        "complexity": 3,
        "risk": 3
      },
      "mandatory": "required",
      "owner": "Enterprise readiness",
      "source_refs": [
        "FD-102b"
      ],
      "effort": "M",
      "confidence": "Medium",
      "state": "In review",
      "mandatory_reason": "Defense in depth for a webview that renders user and notebook content.",
      "external_dependencies": [
        "Overlaps HD-020 Content Security Policy (Codebase audit and hardening backlog, PB-101)"
      ],
      "computed": {
        "benefit": 2.45,
        "cost": 3.0,
        "score": 1.47,
        "priority": "P1"
      },
      "prs": [
        250,
        445
      ]
    },
    {
      "id": "PB-007",
      "title": "Audit trail of runs and changes",
      "category": "Security and Enterprise Readiness",
      "problem": "Nothing records who ran or changed what in a tamper-evident way.",
      "capability": "Hash-chained audit lines, built in PR #89.",
      "evidence": [
        "PR #89 merged; awaiting implementation review"
      ],
      "features": [
        "FEAT-ADM-02",
        "FEAT-PRV-03"
      ],
      "acceptance": [
        "As defined in FD-125",
        "Accepted through the implementation review"
      ],
      "scores": {
        "developer_value": 1,
        "cu_reduction": 1,
        "enterprise_value": 5,
        "differentiation": 2,
        "strategic_alignment": 4,
        "complexity": 2,
        "risk": 2
      },
      "mandatory": "required",
      "owner": "Enterprise readiness",
      "source_refs": [
        "FD-125"
      ],
      "effort": "M",
      "confidence": "High",
      "state": "In review",
      "prs": [
        89
      ],
      "mandatory_reason": "Enterprise compliance needs an audit record of changes to shared data.",
      "external_dependencies": [